{"decision_id":"decision-missing-submission","dossier_id":"case-dossier-1","submission_id":"submission-missing","submission_digest":"sha256:8888888888888888888888888888888888888888888888888888888888888888","decision":"accepted","reviewer_id":"reviewer-a","criteria_reviewed":["criterion-a"],"comment":"Referenced submission is missing","decided_at":"2026-09-04T03:02:01Z","created_operation_id":"op-decision-missing-submission","identity_assurance":"recorded-interactive-claim"}
