{"decision_id":"decision-history","dossier_id":"case-dossier-1","submission_id":"submission-history","submission_digest":"sha256:09cbfc39e199d75fc00c41049d7c48f54fd7f31d6d93bcf268e6795d77d3e870","decision":"rejected","reviewer_id":"reviewer-history","criteria_reviewed":["criterion-a"],"comment":"Superseded review history","decided_at":"2026-09-04T03:02:01Z","created_operation_id":"op-decision-history","identity_assurance":"recorded-interactive-claim"}
